{
  "$schema": "../../schemas/plugin.manifest.v1.schema.json",
  "schemaVersion": 1,
  "id": "com.chattree.example.hello",
  "version": "1.0.0",
  "name": "Hello",
  "description": "Minimal example plugin: greets the user. Uses no capabilities.",
  "author": "Chattree SDK Examples",
  "primaryCommand": "hello",
  "aliases": [],
  "type": "imported",
  "category": "utilities",
  "capabilities": [],
  "tags": [
    "demo",
    "example",
    "hello"
  ],
  "changelog": "1.0.0: Initial release.",
  "runtime": "wasm",
  "entrypoint": "hello",
  "wasmPath": "plugin.wasm",
  "wasmSha256": "9dd8ed1480ce0435851c56aa5de7113e76e1ec1085e4249759ba33731a0424f8",
  "runtimeApiVersion": "1.0.0",
  "maxMemoryPages": 2,
  "timeoutMs": 5000,
  "fuelLimit": 50000000,
  "tools": [
    {
      "id": "com.chattree.example.hello.hello",
      "command": "hello",
      "displayName": "Hello",
      "description": "Greets you: /hello <name>",
      "capabilities": []
    }
  ]
}