{
  "$schema": "../../../schemas/plugin.manifest.v1.schema.json",
  "schemaVersion": 1,
  "id": "com.chattree.official.github",
  "version": "1.0.6",
  "name": "GitHub",
  "description": "Official GitHub integration for Chattree. Inspect repositories, list your projects, view issues, read READMEs, search code, create issues, and manage tokens using natural language or slash commands.",
  "author": "Chattree Core Team",
  "primaryCommand": "github",
  "aliases": [
    "gh",
    "git"
  ],
  "type": "imported",
  "category": "devtools",
  "capabilities": [
    "network.http",
    "storage.private",
    "open.url"
  ],
  "tags": [
    "github",
    "git",
    "devtools",
    "issues",
    "pullrequests",
    "official"
  ],
  "iconUrl": "https://raw.githubusercontent.com/Ponce5/Chattree/main/plugins/official/github/icon.png?v=1.0.6",
  "bannerUrl": "https://raw.githubusercontent.com/Ponce5/Chattree/main/plugins/official/github/banner.png?v=1.0.6",
  "changelog": "1.0.6: Added README reading (phase 6), code search (phase 7), and issue creation (phase 8). All via natural language in WASM.",
  "runtime": "wasm",
  "entrypoint": "github_entry",
  "wasmPath": "plugin.wasm",
  "wasmSha256": "fc073d5d2bd6c2c21a12b6c8ddab6b7da9e2c7cee347b0a11d59ee5ca7712f8e",
  "runtimeApiVersion": "1.0.0",
  "maxMemoryPages": 64,
  "timeoutMs": 30000,
  "fuelLimit": 50000000,
  "tools": [
    {
      "id": "com.chattree.official.github.manager",
      "command": "github",
      "displayName": "GitHub Integration",
      "description": "Interactúa con GitHub en lenguaje natural o con comandos: /github que repos tengo, /github quien soy, /github <owner/repo>, /github issues <owner/repo>, o /github config <token>.",
      "capabilities": [
        "network.http",
        "storage.private",
        "open.url"
      ]
    }
  ]
}
