{
  "$schema": "../../../schemas/plugin.manifest.v1.schema.json",
  "schemaVersion": 1,
  "id": "com.chattree.official.openmark",
  "version": "1.3.0",
  "name": "OpenMark Studio",
  "description": "Studio de presentaciones y diapositivas de carrusel basadas en codigo impulsadas por IA.",
  "author": "Chattree Core Team",
  "primaryCommand": "openmark",
  "aliases": [
    "om",
    "slide",
    "carousel"
  ],
  "type": "imported",
  "category": "media",
  "capabilities": [
    "network.http",
    "storage.private",
    "share.text",
    "canvas.render"
  ],
  "tags": [
    "openmark",
    "carousel",
    "slides",
    "presentation",
    "canvas",
    "design",
    "official"
  ],
  "iconUrl": "https://raw.githubusercontent.com/Ponce5/Chattree/main/plugins/official/openmark/icon.png",
  "bannerUrl": "https://raw.githubusercontent.com/Ponce5/Chattree/main/plugins/official/openmark/banner.png",
  "changelog": "1.3.0: Eliminada plantilla estática fija. Generación de código 100% dinámico por IA según el tema solicitado, con renderizado visual nativo a imagen PNG directamente en el chat y exportación 1080x1080.",
  "runtime": "wasm",
  "entrypoint": "openmark_entry",
  "wasmPath": "plugin.wasm",
  "wasmSha256": "f396c83d4ebc3f831aa1833d7781f9fb33312dbb6424d524f3b0f2d4daf3b2e0",
  "runtimeApiVersion": "1.0.0",
  "maxMemoryPages": 4,
  "timeoutMs": 5000,
  "fuelLimit": 50000000,
  "tools": [
    {
      "id": "com.chattree.official.openmark.create",
      "command": "openmark",
      "displayName": "OpenMark Canvas Studio",
      "description": "Crea una diapositiva visual 1080x1080 con IA: /openmark <tema>",
      "capabilities": [
        "network.http",
        "storage.private",
        "share.text",
        "canvas.render"
      ]
    }
  ]
}
